{
  "schema_version": "1.0",
  "kind": "suite",
  "suite": "transport",
  "run_id": "fixture-stale-001",
  "run_issued_at": "2000-01-01T00:00:00Z",
  "generated_at": "2000-01-01T00:01:00Z",
  "provenance": {"mode": "runner", "ci_authoritative": true},
  "verdict": "FAIL",
  "reason": "VALIDATION_RUN_ID is stale",
  "policies": {"unavailable": "fail", "threshold": "fail"},
  "artifacts": {"summary": "summary.json", "prometheus": "suite.prom"}
}
