{
  "schema_version": "1.0",
  "kind": "suite",
  "suite": "node-smoke",
  "run_id": "fixture-pass-001",
  "run_issued_at": "2026-07-30T12:00:00Z",
  "generated_at": "2026-07-30T12:01:00Z",
  "provenance": {"mode": "runner", "ci_authoritative": true},
  "verdict": "PASS",
  "policies": {"unavailable": "fail", "threshold": "fail"},
  "artifacts": {"summary": "summary.json", "prometheus": "suite.prom"}
}
